{
  "$schema": "https://json-schema.org/draft/2020-12/schema",
  "$id": "https://example.org/schemas/trt.schema.json",
  "title": "Task Requirements Table",
  "type": "object",
  "additionalProperties": false,
  "required": ["trt_id", "version", "lines"],
  "properties": {
    "trt_id": { "type": "string", "minLength": 1 },
    "version": { "type": "string", "pattern": "^v[0-9]+$" },
    "previous_version": { "type": "string", "pattern": "^v[0-9]+$" },
    "released_at": { "type": "string" },
    "release_id": { "type": "string" },
    "audit_id": { "type": "string" },
    "experiment_id": { "type": "string" },
    "tool_sets": {
      "type": "object",
      "additionalProperties": {
        "type": "object",
        "additionalProperties": false,
        "required": ["set_id", "required_tool_ids", "non_member_tool_ids"],
        "properties": {
          "set_id": { "type": "string" },
          "required_tool_ids": {
            "type": "array",
            "items": { "$ref": "#/$defs/tool_id" },
            "uniqueItems": true
          },
          "non_member_tool_ids": {
            "type": "array",
            "items": { "$ref": "#/$defs/tool_id" },
            "uniqueItems": true
          }
        }
      }
    },
    "tool_catalog": {
      "type": "object",
      "additionalProperties": {
        "type": "object",
        "additionalProperties": false,
        "required": ["tool_id", "tool_number", "type", "normalized_type", "belongs_to_ent_set", "set_id", "quantity_instance"],
        "properties": {
          "tool_id": { "$ref": "#/$defs/tool_id" },
          "tool_number": { "type": "integer", "minimum": 1, "maximum": 27 },
          "type": { "type": "string" },
          "normalized_type": { "$ref": "#/$defs/tool_type" },
          "belongs_to_ent_set": { "type": "boolean" },
          "set_id": { "type": ["string", "null"] },
          "quantity_instance": { "type": "integer", "minimum": 1 }
        }
      }
    },
    "lines": {
      "type": "object",
      "minProperties": 1,
      "additionalProperties": {
        "type": "object",
        "additionalProperties": false,
        "required": ["goal", "allowed_instruments", "excluded_instruments", "priority", "kpi", "abnormal_strategy"],
        "properties": {
          "goal": {
            "enum": ["ROUTINE_CLASSIFICATION", "TRAUMA_SET_PRIORITY", "BACKLOG_CLEARING"]
          },
          "allowed_instruments": {
            "type": "array",
            "items": { "$ref": "#/$defs/instrument" },
            "uniqueItems": true
          },
          "excluded_instruments": {
            "type": "array",
            "items": { "$ref": "#/$defs/instrument" },
            "uniqueItems": true
          },
          "target_set_id": { "type": "string" },
          "selected_tool_ids": {
            "type": "array",
            "items": { "$ref": "#/$defs/tool_id" },
            "uniqueItems": true
          },
          "excluded_tool_ids": {
            "type": "array",
            "items": { "$ref": "#/$defs/tool_id" },
            "uniqueItems": true
          },
          "required_tool_ids": {
            "type": "array",
            "items": { "$ref": "#/$defs/tool_id" },
            "uniqueItems": true
          },
          "manipulator_priority": { "$ref": "#/$defs/manipulator_priority" },
          "priority": {
            "type": "integer",
            "minimum": 1,
            "maximum": 5
          },
          "kpi": {
            "type": "object",
            "additionalProperties": false,
            "required": ["deadline_minutes", "max_downtime_seconds", "min_throughput_per_hour"],
            "properties": {
              "deadline_minutes": {
                "type": ["integer", "null"],
                "minimum": 0
              },
              "max_downtime_seconds": {
                "type": ["integer", "null"],
                "minimum": 0
              },
              "min_throughput_per_hour": {
                "type": "integer",
                "minimum": 0
              }
            }
          },
          "abnormal_strategy": {
            "enum": ["STOP_LINE", "CONTINUE_FEASIBLE_TASKS", "ASK_OPERATOR"]
          },
          "tooling_policy": {
            "type": "object",
            "additionalProperties": false,
            "required": ["required_scope"],
            "properties": {
              "required_scope": {
                "enum": ["ALLOWED_INSTRUMENTS", "ALL_SUPPORTED_INSTRUMENTS", "ALL_SUPPORTED_TOOLING", "SELECTED_TOOLING", "NONE"]
              }
            }
          },
          "digital_twin": {
            "type": "object",
            "additionalProperties": false,
            "required": [
              "robot_id",
              "robot_model",
              "robot_scene_name",
              "workspace_id",
              "workspace_env_id",
              "stage_workspace_prim_path",
              "stage_robot_prim_path",
              "stage_end_effector_prim_path",
              "stage_tooling_root_prim_path",
              "stage_tray_prim_path",
              "tray_id",
              "active_set_id",
              "task_name"
            ],
            "properties": {
              "robot_id": { "type": "string" },
              "robot_model": { "type": "string" },
              "robot_scene_name": { "type": "string" },
              "workspace_id": { "type": "string" },
              "workspace_env_id": { "type": "integer", "minimum": 0 },
              "stage_workspace_prim_path": { "type": "string" },
              "stage_robot_prim_path": { "type": "string" },
              "stage_end_effector_prim_path": { "type": "string" },
              "stage_tooling_root_prim_path": { "type": "string" },
              "stage_tray_prim_path": { "type": ["string", "null"] },
              "tray_id": { "type": "string" },
              "active_set_id": { "type": "string" },
              "task_name": { "type": "string" },
              "line_type": { "type": "string" },
              "simulation_mode": { "enum": ["PHYSICAL_OR_DIGITAL_TWIN", "LOGICAL_ONLY"] },
              "physical_available": { "type": ["boolean", "null"] },
              "input_area_path": { "type": "string" },
              "output_area_path": { "type": "string" }
            }
          },
          "state": {
            "type": "object",
            "additionalProperties": false,
            "required": ["mode", "current_task", "wip_count", "last_exception"],
            "properties": {
              "mode": {
                "enum": ["IDLE", "RUNNING", "INTERVENTION", "PAUSED", "ERROR"]
              },
              "current_task": {
                "type": ["string", "null"]
              },
              "wip_count": {
                "type": "integer",
                "minimum": 0
              },
              "last_exception": {
                "type": ["string", "null"]
              }
            }
          }
        }
      }
    }
  },
  "$defs": {
    "instrument": {
      "enum": ["SCISSORS", "FORCEPS", "CLAMPS", "RETRACTOR"]
    },
    "tool_id": {
      "type": "string",
      "pattern": "^tool_(0[1-9]|1[0-9]|2[0-7])$"
    },
    "tool_type": {
      "enum": [
        "FORCEPS",
        "SCISSORS",
        "DOUBLE_ENDED_SURGICAL_RETRACTOR",
        "SURGICAL_FORCEPS",
        "KNIFE_HANDLE",
        "SPONGE_FORCEPS",
        "NEEDLE_HOLDER",
        "NERVE_RETRACTOR",
        "MASTOID_RETRACTOR",
        "SURGICAL_SUCTION_CANNULA"
      ]
    },
    "manipulator_priority": {
      "type": "object",
      "additionalProperties": false,
      "required": ["policy", "ordered_tool_ids", "ordered_normalized_types", "tie_breaker", "enabled"],
      "properties": {
        "policy": {
          "enum": ["FCFS", "REQUIRED_FIRST", "UNWANTED_FIRST", "EXPLICIT_TOOL_ORDER", "EXPLICIT_TYPE_ORDER", "HIGHEST_RISK_FIRST", "LOWEST_RISK_FIRST"]
        },
        "ordered_tool_ids": {
          "type": "array",
          "items": { "$ref": "#/$defs/tool_id" },
          "uniqueItems": true
        },
        "ordered_normalized_types": {
          "type": "array",
          "items": { "$ref": "#/$defs/tool_type" },
          "uniqueItems": true
        },
        "tie_breaker": { "enum": ["FCFS"] },
        "enabled": { "type": "boolean" }
      }
    }
  }
}
